{
  "$id": "https://sdlc.local/schemas/eval-case.schema.json",
  "$schema": "https://json-schema.org/draft/2020-12/schema",
  "type": "object",
  "properties": {
    "schema": {
      "type": "number",
      "const": 1
    },
    "id": {
      "type": "string",
      "pattern": "^(CASE|INC)-[A-Za-z0-9][A-Za-z0-9-]*$"
    },
    "prompt": {
      "type": "string",
      "minLength": 1
    },
    "checks": {
      "type": "array",
      "items": {
        "type": "object",
        "properties": {
          "name": {
            "type": "string",
            "minLength": 1
          },
          "cmd": {
            "type": "string",
            "minLength": 1
          },
          "healthyOutput": {
            "type": "string"
          }
        },
        "required": [
          "name",
          "cmd"
        ],
        "additionalProperties": false
      }
    },
    "source": {
      "type": "object",
      "properties": {
        "type": {
          "type": "string",
          "enum": [
            "change",
            "incident",
            "manual"
          ]
        },
        "ref": {
          "type": "string"
        }
      },
      "required": [
        "type"
      ],
      "additionalProperties": false
    },
    "owner": {
      "type": "string",
      "minLength": 1
    },
    "added": {
      "type": "string",
      "format": "date-time",
      "pattern": "^(?:(?:\\d\\d[2468][048]|\\d\\d[13579][26]|\\d\\d0[48]|[02468][048]00|[13579][26]00)-02-29|\\d{4}-(?:(?:0[13578]|1[02])-(?:0[1-9]|[12]\\d|3[01])|(?:0[469]|11)-(?:0[1-9]|[12]\\d|30)|(?:02)-(?:0[1-9]|1\\d|2[0-8])))T(?:(?:[01]\\d|2[0-3]):[0-5]\\d:[0-5]\\d(?:\\.\\d+)?(?:Z|([+-](?:[01]\\d|2[0-3]):[0-5]\\d)))$"
    },
    "status": {
      "type": "string",
      "enum": [
        "draft",
        "active",
        "retired"
      ]
    },
    "paths": {
      "type": "array",
      "items": {
        "type": "string",
        "minLength": 1
      }
    }
  },
  "required": [
    "schema",
    "id",
    "prompt",
    "checks",
    "source",
    "owner",
    "added",
    "status",
    "paths"
  ],
  "additionalProperties": false
}
